{
  "schema_version": "0.1.0",
  "metadata": {
    "tool_name": "authmap",
    "tool_version": "0.1.0",
    "mode": "advisory",
    "target_roots": [],
    "config_path": null
  },
  "source_files": [],
  "routes": [],
  "evidence": [],
  "mutations": [],
  "links": [],
  "coverage": [],
  "diagnostics": []
}